{
  "schemaVersion": 1,
  "runId": "fresh-agent-v1-impact-nestjs-provider-contract-no-atlas",
  "caseId": "impact-nestjs-provider-contract",
  "mode": "no-atlas",
  "fixtureRevision": "fixture-v1",
  "agent": {
    "product": "codex-cli 0.146.0",
    "model": "gpt-5.6-sol",
    "freshContext": true
  },
  "protocol": {
    "runnerVersion": "fresh-agent-runner-v2",
    "fixtureCommit": "5a7bf9ec5c4a52148410b71c68d753a7f74ff47d",
    "instructionsHash": "27c054619463ba6837155f2decf5b451ea45b4fbb5867d948601d6f6e6ca183d",
    "toolPolicyHash": "69c5adc571c298c283fc4449b481e97ff2dac2f87087d6efb5b805394c4de292",
    "oracleHidden": true,
    "commandAuditPassed": true,
    "commandAudit": {
      "policy": "fresh-agent-shell-allowlist-v4",
      "commands": [
        "/bin/zsh -lc 'rg --files'",
        "/bin/zsh -lc '$EVALUATION_OBSERVER search '\"'placeOrder' .\"",
        "/bin/zsh -lc 'node \"$EVALUATION_OBSERVER\" search '\"'placeOrder' .\"",
        "/bin/zsh -lc 'node \"$EVALUATION_OBSERVER\" search '\"'OrderService' .\"",
        "/bin/zsh -lc 'node \"$EVALUATION_OBSERVER\" read '\"'src/orders/orders.controller.ts'\"",
        "/bin/zsh -lc 'node \"$EVALUATION_OBSERVER\" read '\"'src/orders/order.entity.ts'\"",
        "/bin/zsh -lc 'node \"$EVALUATION_OBSERVER\" read '\"'src/orders/orders.module.ts'\"",
        "/bin/zsh -lc 'node \"$EVALUATION_OBSERVER\" read '\"'src/orders/order.resolver.ts'\"",
        "/bin/zsh -lc 'node \"$EVALUATION_OBSERVER\" read '\"'test/orders/order.service.test.ts'\"",
        "/bin/zsh -lc 'node \"$EVALUATION_OBSERVER\" read '\"'src/orders/order.service.ts'\"",
        "/bin/zsh -lc 'node \"$EVALUATION_OBSERVER\" search '\"'orders.controller' .\"",
        "/bin/zsh -lc 'node \"$EVALUATION_OBSERVER\" search '\"'OrdersModule' .\"",
        "/bin/zsh -lc 'node \"$EVALUATION_OBSERVER\" search '\"'order.resolver' .\"",
        "/bin/zsh -lc 'node \"$EVALUATION_OBSERVER\" search '\"'order.service' .\""
      ]
    }
  },
  "startedAt": "2026-08-14T06:40:50.825Z",
  "finishedAt": "2026-08-14T06:42:40.205Z",
  "observations": {
    "sourceTokenMethod": "tiktoken-o200k_base-v1",
    "sourceOpens": [
      {
        "sequence": 1,
        "file": "src/orders/order.resolver.ts",
        "sourceTokens": 34
      },
      {
        "sequence": 2,
        "file": "src/orders/order.service.ts",
        "sourceTokens": 32
      },
      {
        "sequence": 3,
        "file": "src/orders/orders.controller.ts",
        "sourceTokens": 26
      },
      {
        "sequence": 4,
        "file": "test/orders/order.service.test.ts",
        "sourceTokens": 43
      },
      {
        "sequence": 5,
        "file": "src/orders/order.resolver.ts",
        "sourceTokens": 50
      },
      {
        "sequence": 6,
        "file": "src/orders/order.service.ts",
        "sourceTokens": 23
      },
      {
        "sequence": 7,
        "file": "src/orders/orders.controller.ts",
        "sourceTokens": 52
      },
      {
        "sequence": 8,
        "file": "src/orders/orders.module.ts",
        "sourceTokens": 62
      },
      {
        "sequence": 9,
        "file": "test/orders/order.service.test.ts",
        "sourceTokens": 70
      },
      {
        "sequence": 10,
        "file": "src/orders/order.entity.ts",
        "sourceTokens": 99
      },
      {
        "sequence": 11,
        "file": "src/orders/orders.controller.ts",
        "sourceTokens": 115
      },
      {
        "sequence": 12,
        "file": "src/orders/order.resolver.ts",
        "sourceTokens": 148
      },
      {
        "sequence": 13,
        "file": "src/orders/orders.module.ts",
        "sourceTokens": 154
      },
      {
        "sequence": 14,
        "file": "test/orders/order.service.test.ts",
        "sourceTokens": 209
      },
      {
        "sequence": 15,
        "file": "src/orders/order.service.ts",
        "sourceTokens": 205
      },
      {
        "sequence": 16,
        "file": "src/orders/orders.module.ts",
        "sourceTokens": 29
      },
      {
        "sequence": 17,
        "file": "src/orders/order.resolver.ts",
        "sourceTokens": 31
      },
      {
        "sequence": 18,
        "file": "src/orders/orders.module.ts",
        "sourceTokens": 30
      },
      {
        "sequence": 19,
        "file": "src/orders/orders.module.ts",
        "sourceTokens": 23
      },
      {
        "sequence": 20,
        "file": "src/orders/orders.controller.ts",
        "sourceTokens": 34
      },
      {
        "sequence": 21,
        "file": "src/orders/orders.module.ts",
        "sourceTokens": 29
      },
      {
        "sequence": 22,
        "file": "test/orders/order.service.test.ts",
        "sourceTokens": 33
      }
    ],
    "atlasCalls": [],
    "atlasHandling": []
  },
  "answer": {
    "response": "Assuming “new argument” means a required call-time parameter, there are three direct callers:\n\n- `src/orders/order.resolver.ts` — `OrderResolver.createOrder` must obtain the value through a new GraphQL `@Args(...)` parameter and pass it to `placeOrder`.\n- `src/orders/orders.controller.ts` — `OrdersController.create` must obtain/pass the value from the HTTP request.\n- `test/orders/order.service.test.ts` — the `persists a newly placed order` test must supply the value.\n\nThe composition points are:\n\n- `OrdersModule` registers `OrderService` and `OrderResolver`, registers `OrdersController`, provides the `Order` repository through `TypeOrmModule.forFeature([Order])`, and exports `OrderService`.\n- `OrderResolver.constructor` and `OrdersController.constructor` consume `OrderService` through Nest injection.\n- The service test manually constructs `OrderService` with `new OrderService(repository)`.\n\nA method-argument-only change does not require changes to these Nest provider registrations or constructors—the constructor dependency contract remains unchanged. `OrdersModule` exports the service, but no other in-repository module imports `OrdersModule` and no additional `placeOrder` callers were found; consumers outside this fixture cannot be enumerated.\n\nCurrently `placeOrder` accepts one `PlaceOrderInput` object. If the change is instead a required field inside that object, update `PlaceOrderInput`; the controller’s forwarding statement can remain syntactically unchanged, while the resolver and test object literals must add the field and HTTP clients must include it.",
    "reportedFiles": [
      "src/orders/order.service.ts",
      "src/orders/order.resolver.ts",
      "src/orders/orders.controller.ts",
      "src/orders/orders.module.ts",
      "test/orders/order.service.test.ts"
    ],
    "reportedSymbols": [
      {
        "file": "src/orders/order.service.ts",
        "name": "PlaceOrderInput"
      },
      {
        "file": "src/orders/order.service.ts",
        "name": "OrderService.constructor"
      },
      {
        "file": "src/orders/order.service.ts",
        "name": "OrderService.placeOrder"
      },
      {
        "file": "src/orders/order.resolver.ts",
        "name": "OrderResolver.constructor"
      },
      {
        "file": "src/orders/order.resolver.ts",
        "name": "OrderResolver.createOrder"
      },
      {
        "file": "src/orders/orders.controller.ts",
        "name": "OrdersController.constructor"
      },
      {
        "file": "src/orders/orders.controller.ts",
        "name": "OrdersController.create"
      },
      {
        "file": "src/orders/orders.module.ts",
        "name": "OrdersModule"
      },
      {
        "file": "test/orders/order.service.test.ts",
        "name": "describe(\"OrderService\") > it(\"persists a newly placed order\")"
      }
    ]
  },
  "adjudication": {
    "correct": true,
    "notes": "Identifies both required entry-point callers, OrderResolver.createOrder and OrdersController.create, as well as the NestJS composition point OrdersModule and the OrderService.placeOrder contract. All required files and symbols are covered.",
    "failureClassifications": []
  }
}
