{
  "schemaVersion": 1,
  "runId": "fresh-agent-v1-location-nestjs-graphql-mutation-no-atlas",
  "caseId": "location-nestjs-graphql-mutation",
  "mode": "no-atlas",
  "fixtureRevision": "fixture-v1",
  "agent": {
    "product": "codex-cli 0.146.0",
    "model": "gpt-5.6-sol",
    "freshContext": true
  },
  "protocol": {
    "runnerVersion": "fresh-agent-runner-v1",
    "fixtureCommit": "5a7bf9ec5c4a52148410b71c68d753a7f74ff47d",
    "instructionsHash": "bbc9aae6a3886e13042c5866566f34c9de7e15b26e6d60d0fbc6071431bf1b9d",
    "toolPolicyHash": "03b90005d5ff59da4c1f47b3ec3ac53c5dcc885466b9a58fa6ceb6f83fc98667",
    "oracleHidden": true,
    "commandAuditPassed": true,
    "commandAudit": {
      "policy": "fresh-agent-shell-allowlist-v4",
      "commands": [
        "/bin/zsh -lc \"printf '%s\\\\n' \\\"\"'$EVALUATION_OBSERVER\" && rg --files -g '\"'\"'!node_modules'\"' | sed -n '1,240p'\"",
        "/bin/zsh -lc 'node \"$EVALUATION_OBSERVER\" search '\"'createOrder|CreateOrder|create-order' src test\"",
        "/bin/zsh -lc 'node \"$EVALUATION_OBSERVER\" read src/orders/order.resolver.ts 1 220'",
        "/bin/zsh -lc 'node \"$EVALUATION_OBSERVER\" read src/orders/orders.module.ts 1 220'",
        "/bin/zsh -lc 'node \"$EVALUATION_OBSERVER\" read src/orders/order.service.ts 1 260'"
      ]
    }
  },
  "startedAt": "2026-08-14T05:29:32.146Z",
  "finishedAt": "2026-08-14T05:30:23.535Z",
  "observations": {
    "sourceTokenMethod": "tiktoken-o200k_base-v1",
    "sourceOpens": [
      {
        "sequence": 1,
        "file": "src/orders/order.resolver.ts",
        "sourceTokens": 25
      },
      {
        "sequence": 2,
        "file": "src/orders/order.resolver.ts",
        "sourceTokens": 148
      },
      {
        "sequence": 3,
        "file": "src/orders/orders.module.ts",
        "sourceTokens": 154
      },
      {
        "sequence": 4,
        "file": "src/orders/order.service.ts",
        "sourceTokens": 205
      }
    ],
    "atlasCalls": [],
    "atlasHandling": []
  },
  "answer": {
    "response": "The create-order GraphQL mutation is `OrderResolver.createOrder` in `src/orders/order.resolver.ts:10`. It accepts `customerId` and `totalCents`, then delegates to the constructor-injected `OrderService` via `this.orders.placeOrder({ customerId, totalCents })`.\n\nThe delegated NestJS operation is `OrderService.placeOrder` in `src/orders/order.service.ts:19`. It creates an `Order` entity and persists it with the injected TypeORM repository. `OrdersModule` registers both `OrderService` and `OrderResolver` as providers.",
    "reportedFiles": [
      "src/orders/order.resolver.ts",
      "src/orders/order.service.ts",
      "src/orders/orders.module.ts"
    ],
    "reportedSymbols": [
      {
        "file": "src/orders/order.resolver.ts",
        "name": "OrderResolver.constructor"
      },
      {
        "file": "src/orders/order.resolver.ts",
        "name": "OrderResolver.createOrder"
      },
      {
        "file": "src/orders/order.service.ts",
        "name": "OrderService"
      },
      {
        "file": "src/orders/order.service.ts",
        "name": "OrderService.placeOrder"
      },
      {
        "file": "src/orders/orders.module.ts",
        "name": "OrdersModule"
      }
    ]
  },
  "adjudication": {
    "correct": true,
    "notes": "Correctly traces OrderResolver.createOrder to the injected OrderService.placeOrder operation.",
    "failureClassifications": []
  }
}
